ontolidar:CleanAirDetection,Clean air detection,,,Rilevamento di condizione di aria pulita,,超净空气识别,,,"A quantity to indicate the weather is in clean air condition (less aerosols), and the correponsing lidar measurement data shall be specially processed during data filtering",一个范围（或数值）用来表示空气中含有较少的气溶胶，在数据过滤过程中应特别处理对应的测量数据。,,Filtro specifico per rimuovere dati spuri dovuti alla presenza di aria pulita nel tragitto del raggio laser.,"Cantidad que indica condiciones de aire limpio (escasez de aerosoles), y los datos de medición lidar correpondientes serán especialmente procesados durante el filtrado de datos.",,ontolidar:DataFiltering
ontolidar:FogDetection,Fog detection,,,Rilevamento di nebbia,,大雾天气识别,,,"A quantity to indicate the weather is in fog condition, and the correponsing lidar measurement data shall be specially processed during data filtering",表示天气处于大雾状态的数量，在数据过滤过程中应特别处理相关的激光雷达测量数据。,,Filtro specifico per rimuovere dati spuri dovuti alla presenza di nebbia nel tragitto del raggio laser.,"Cantidad que indica condiciones de niebla, y los datos de medición lidar correpondientes serán especialmente procesados durante el filtrado de datos.",,ontolidar:DataFiltering
ontolidar:CoordinateSystemTransformation,Coordinate system transformation,,,Trasformazione del sistema di coordinate,,坐标系统转换,,,"Transfer the data from the lidar default coordinate system (e.g. spherical coordinate system, etc.) to the coordinate system required by data application (e.g. right hand inertial coordinate system)",将数据从激光雷达默认坐标系（如球面坐标系等）转移到数据应用所需的坐标系（如右手惯性坐标系）。,,Cambio di coordinate dal sistema solidale con il lidar (tipicamente coordinate sferiche) allo specifico sistema di coordinate richiesto dall'applicazione cui si ha interesse.,"Proceso matemático de transformación de los datos en el sistema de coordenadas por defecto del lidar (por ejemplo, el sistema de coordenadas esféricas, etc.) al sistema de coordenadas requerido por la aplicación que post procesará los datos (por ejemplo, el sistema inercial de coordenadas cartesianas definido por la regla de la mano derecha).",,ontolidar:DataProcessing
ontolidar:MeasurementSetup,Measurement setup,,,Disposizione di misurazione,,测量设置
ontolidar:ScanGeometry,Scan geometry,,Geometrie scannen,Geometria di scansione,Geometría de escaneo,扫描的几何路径,,,1. The arrangement of a sequence of scanning lidar configurations that require the lidar beam to be scanned or swept between a number of different orientations. The scan geometry ensures measurements are acquired throughout the measurement volume sufficient for wind field reconstruction. The sequence of beam orientations may be repeated to acquire a time series of final data acquired from each iteration. Scans may be performed in stop-stare or sweep-stare mode. 2. The collection of lines of sight / beam orientations along which the lidar is programmed to emit its probe.,1. 激光雷达扫描方式（顺序）的安排，要求激光雷达光束在一些不同的方向之间扫描或扫过。扫描的几何路径确保在整个测量范围内获得足够的测量结果以重建气流（风）流场。对应的光束方向的可以重复进行扫描，通过迭代扫描获得时间序列的数据集。扫描可以在停滞或扫掠模式下进行。2. 激光雷达的扫描光束方向，沿着雷达程序设定的发射其探测信号的方向。,,1. Una serie di configurazioni di misuraizone per uno scanning lidar che definisce come il fascio laser debba essere mosso e spostato fra una serie di posizioni pre-definite. Questa serie garantisce l'acquisizione in misura sufficiente di dati per ricostruire il campo di vento. La sequenza delle orientazioni può essere ripetuta per registrare una serie temporale della stessa quantità misurata. Il movimento da una posizione di misurazione alla successiva può essere effettuato in modalità stop-stare o sweep-stare. 2. L'insieme delle direzioni di misurazione / orientazioni del fascio laser in cui il lidar emette la sua sonda.,"1. Serie de configuraciones de medidas realizadas por un lidar de escaneo que requieren que el haz lidar sea escaneado o barrido entre un número de orientacions diferentes. La geometría de barrido asegura que se adquieran mediciones en un volumen suficiente para posibilitar la reconstrucción del campo de viento. La secuencia de orientaciones del haz puede repetirse para adquirir una serie temporalde datos finales, adquiridos en cada iteración. Los escaneos pueden realizarse en modo stop-stare o sweep-stare. 2. La colección de líneas de visión (line-of-sight o LOS, por sus siglas en inglés)  del haz a lo largo de las cuales el lidar está programado para emitir su sondeo.",Scan pattern,ontolidar:MeasurementSetup,,,,,,The scanning geometry taxonomy is based on Figure 3 in NREL/TP-5000-64634 https://www.nrel.gov/docs/fy16osti/64634.pdf,,La tassonomia della geometria di scansione è basata sulla figura 3 di NREL/TP-5000-64634 https://www.nrel.gov/docs/fy16osti/64634.pdf,La taxonomía de la geometría de escaneo está basada en la Figura 3 de NREL/TP-5000-64634 https://www.nrel.gov/docs/fy16osti/64634.pdf
ontolidar:SingleLidar,Single lidar,,Einzel-Lidar,Lidar singolo,Lidar individual,单个激光雷达,,,A single lidar that returns line-of-sight data that are converted in to windfield characteristics without the use of data from another lidar or wind speed measurement device.,仅用单独的一个激光雷达，凭其自身测量的视向数据推算出气流（风）特性，而无需使用来自另一个激光雷达或风速测量设备的数据。,,Misurazioni effettuate da un lidar singolo,"Un solo lidar aislado que devuelve datos de la línea de visión (line-of-sight o LOS, por sus siglas en inglés)  que se convierten en características del campo de viento sin el uso de datos de otro lidar o dispositivo de medición de la velocidad del viento.",,ontolidar:ScanGeometry
ontolidar:SimpleScan,Simple scan,,einfacher Scan,Scansione semplice,Escaneo simple,简单扫描,,,A scan geometry which entails a variation in beam orientation in a single degree of freedom,一种简单的扫描路径，通过方向在单个自由度内的控制来改变扫描位置,,Una geometria di scansione dello spazio dove la posizione del raggio laser dipende da un solo parametro. ,Una geometría de escaneo simple en que la posición del rayo depende de un solo parámetro.,,ontolidar:SingleLidar
ontolidar:VariableAzimuthScan,Variable azimuth scan,,Variabler Azimut-Scan,Scansione ad azimut variabile,Escaneo de azimut variable,变方位扫描法,,,A simple scan geometry with variable azimuth angle,通过改变方位角来控制扫描位置的简单扫描方式,,Una geometria di scansione dello spazio dipendente solo dall'angolo di azimut del sistema.,Geometría de escaneo simple que sólo depende del ángulo azimut.,PPI,ontolidar:SimpleScan
ontolidar:CompleteCone,Complete cone,,Vollständiger Kegel,Geometria a cono completo,Geometía de cono completo,完整的锥体扫描法,,,A scan geometry in which the azimuth angle of the beam is varied in increments over the full 360 degree range of possible azimuth angles.,一种扫描方式，其中光束的方位角在可能方位角的整个 360 度范围内变化。风速和风向值可以通过气流流场重建推算获得，例如通过假定计算值（风速，风向）与方位角存在正弦函数关系。,,"Una geometria di scansione dello spazio in cui il fascio laser è mosso lungo tutto l'intervallo di 360 gradi dell'angolo azimutale. La velocità e la direzione del vento possono essere ottenute attraverso un processo di ricostruzione del campo ventoso che assume, per esempio, una dipendenza sinusoidale della velocità radiale dall'angolo di azimuth.","Geometría en la que el azimut puede variar a lo largo de un intervalo de 360 grados. Los valores de velocidad y dirección del viento se pueden obertener a través de un proceso de reconstrucción del campo de viento asumiendo, por ejemplo, una dependencia sinusoidal de la velocidad radial con el ángulo azimutal.",,ontolidar:VariableAzimuthScan,,,,,,"Wind speed and direction values can be obtained through a wind field reconstruction process, for example by assuming a sinusoidal dependence on azimuth angle.",,,"La velocidad y dirección del viento puedens ser obtenidos mediante un proceso de reconstrucción del campo de vientos, asumiendo por ejemplo una dependencia senoidal con el ángulo azimutal."
ontolidar:ConeSector,Cone sector,,Kegelsektor,Geometria a settore di cono,Geometría de cono sectorial,锥体扇形扫描法,,,A scan geometry in which the azimuth angle of the beam is varied in increments over less than the full 360 degree range of possible azimuth angles.,一种扫描方式，其中光束的方位角在小于360 度范围内变化。风速和风向值可以通过气流流场重建推算获得，例如通过假定计算值（风速，风向）与方位角存在正弦函数关系。,,"Una geometria di scansione dello spazio in cui il fascio laser è mosso lungo una porzione dell'intervallo di 360 gradi dell'angolo azimutale. La velocità e la direzione del vento possono essere ottenute attraverso un processo di ricostruzione del campo ventoso che assume, per esempio, una dipendenza sinusoidale della velocità radiale dall'angolo di azimuth.","Geometría de escaneo en la cual el ángulo de escaneo azimutal se varía a lo largo de un intervalo inferior a 360 grados. Los valores de velocidad y dirección del viento se pueden obertener a través de un proceso de reconstrucción del campo de viento asumiendo, por ejemplo, una dependencia sinusoidal de la velocidad radial con el ángulo azimutal.","Plan-position indicator, PPI",ontolidar:VariableAzimuthScan,,,,,,"Wind speed and direction values can be obtained through a wind field reconstruction process, for example by assuming a sinusoidal dependence on azimuth angle.",,,"La velocidad y dirección del viento puedens ser obtenidos mediante un proceso de reconstrucción del campo de vientos, asumiendo por ejemplo una dependencia senoidal con el ángulo azimutal."
ontolidar:DopplerBeamSwinging,Doppler beam swinging,,Schwingender Dopplerstrahl,Geometria ad oscillazione del fascio laser,Geometría de oscilación del haz Doppler,多普勒光束摆动扫描法,,,"A scan measurement principle in which the wind velocity reconstruction algorithm calculates wind velocity vector components immediately upon a new radial wind velocity becoming available. This technique provides the maximum sampling rate of the wind velocity components and consequently the wind velocity vector, which is desirable for instance in turbulence measurements.",一种扫描方式，其中光束的方位角在可能的方位角的整个 360 度范围内间隔90度变化。风速和风向值可以通过气流流场重建推算获得，例如通过假定计算值（风速，风向）与方位角存在正弦函数关系。,,"Una geometria di scansione dello spazio in cui il fascio laser è mosso in intervalli di 90 gradi lungo l'angolo azimutale. La velocità e la direzione del vento possono essere ottenute attraverso un processo di ricostruzione del campo ventoso che assume, per esempio, una dipendenza sinusoidale della velocità radiale dall'angolo di azimuth.","Geometría de escaneo en la cual el ángulo de escaneo azimutal se varía enintervalos de 90 grados a lo largo de los 360 grados posibles del ángulo azimutal. Los valores de velocidad y dirección del viento se pueden obertener a través de un proceso de reconstrucción del campo de viento asumiendo, por ejemplo, una dependencia sinusoidal de la velocidad radial con el ángulo azimutal.",DBS,ontolidar:VariableAzimuthScan,,,,,,"Reference: Kelberlau, F. and Mann, J. “Cross-contamination effect on turbulence spectra from Doppler beam swinging wind lidar”, Wind Energ. Sci., 5, 519–541, 2020",,,"Referencias: Kelberlau, F. and Mann, J. “Cross-contamination effect on turbulence spectra from Doppler beam swinging wind lidar”, Wind Energ. Sci., 5, 519–541, 2020"
ontolidar:VariableElevationScan,Variable elevation scan,,,Geometria ad elevazione variabile,Geometría de elevación variable,可变仰角扫描法,,,A simple scan geometry with variable elevation angle,具有可变仰角的简单扫描方式,,Una geometria di scansione dello spazio in cui l'angolo di elevazione varia.,Geometría de escaneo simple que sólo depende del ángulo de elevación.,RHI,ontolidar:SimpleScan,,,,,,The scanning geometry taxonomy is based on Figure 3 in NREL/TP-5000-64634 https://www.nrel.gov/docs/fy16osti/64634.pdf,,La tassonomia della geometria di scansione è basata sulla figura 3 di NREL/TP-5000-64634 https://www.nrel.gov/docs/fy16osti/64634.pdf,La taxonomía de la geometría de escaneo se basa en la Figura 3 en NREL/TP-5000-64634 https://www.nrel.gov/docs/fy16osti/64634.pdf
ontolidar:CompoundScan,Compound scan,,,Scansione composita,Escaneo compuesto,复合扫描扫描法,,,Compound scans include more degrees of freedom and are typically made up of a sequence of simple scans,复合扫描包括更多的自由度，通常由一系列简单的扫描方法组成,,Una scansione composita include più gradi di libertà ed è tipicamente il risultato di una combinazione di più sequenze di scansioni semplici.,Los escaneos compuestos incluyen más grados de libertad y suelen estar formados por una secuencia de escaneos simples.,,ontolidar:SingleLidar
ontolidar:ArbitraryTrajectory,Arbitrary trajectory,,,Traiettoria arbitraria,Trayectoria arbitraria,任意运动轨迹扫描法,,,Scans can be made where the beam is swept through an arbitrary combination of elevation and azimuth angles to follow a desired trajectory. This could be considered analagous to tracking the path of a flying bird from a fixed location.,一种测风激光雷达的扫描方法，可以通过仰角和方位角的任意组合，跟踪所需轨迹进行扫描。比如：站在一个固定位置跟踪飞鸟的路径。,,Una geometria di misurazione dove il fascio laser è mosso lungo una combinazione arbitraria di angoli di elevazione e azimutali per seguire una specifica traiettoria spaziale. Questo è del tutto analogo ad una situazione in cui si volesse descrivere in termini geometrici il volo di un uccello utilizzando un punto di riferimento fisso.,Se pueden realizar escaneos en los que el haz realiza un barrido variando arbitrariamente los ángulos de elevación y acimut para seguir una trayectoria determinada. Esto podría considerarse análogo al seguimiento de la trayectoria de un pájaro en vuelo desde una ubicación fija.,,ontolidar:SingleLidar
ontolidar:StopStare,Stop-stare,,,"Geometria ""osserva da fisso""",Geometría de punto fijo,停止-凝视扫描法,,,Line-of-sight data are acquired while the beam remains stationary in one of the pre-determined orientations comprising the scan geometry. No data are acquired while the beam is moved to its next position.,一种测风激光雷达的扫描方法，只有当光束在预设扫描方向上保持静止时，才获取视线方向(LOS)的数据。当光束在预设位置之间切换移动时，不获取数据。,,Metodo di acquisizione dati in cui la misurazione avviene mentre il fascio laser è mantenuto fermo nello spazio in una direzione predefinita. Nessuna misurazione è effettuata durante la fase di riposizionamento del fascio laser. ,"Los datos de la línea de visión (line-of-sight o LOS, por sus siglas en inglés) son adquiridos mientras el rayo permanece estacionario en una de las orientaciones predeterminada a lo largo de la secuencia de escaneo. Ninguna medida se realiza durante la fase de reposicionamiento del laser a su siguiente posición.",,ontolidar:SingleLidar
ontolidar:SweepStare,Sweep-stare,,,"Geometria ""osserva in movimento""",Geometría de barrido,扫视扫描法,,,Line-of-sight data are acquired continuously as the beam is scanned between pre-determined positions.,一种测风激光雷达的扫描方法，当光束在预定位置之间移动时，也会连续获取视线方向(LOS)的数据。,,Metodo di acquisizione dati in cui la misurazione avviene mentre il fascio laser è costantemente mosso nello spazio.,"Los datos de la línea de visión (line-of-sight o LOS, por sus siglas en inglés) son adquiridos continuamente, mientras el rayo recorre las posiciones de escaneo programadas.",,ontolidar:SingleLidar
ontolidar:Staring,Staring,,,Geometria fissa,Geometría fija,凝视（单向）扫描法,,,A scan geometry comprised of a single beam orientation.,光束仅在单一方向扫描的扫描方式。,,Un lidar con orientazione del fascio laser fissa nello spazio.,Geometría de escaneo que comprende una sola orientación del rayo de medición.,,ontolidar:SingleLidar
ontolidar:MultiLidar,Multi-lidar,,,Multi-lidar,Multi-lidar,多激光雷达,,,Coordinated measurements made in the same region by multiple lidar. Measurements may or may not be synchronised in time.,多个激光雷达在同一区域进行的协调测量。测量结果在时间上可能会（或不会）同步。,,Misurazioni coordinate effettuate nella stessa regione da più sistemi lidar. Le misurazioni possono essere sincronizzate nel tempo.,Medidas coordinadas relizadas en la misma región por diferentes dispositivos lidar. Las medidas pueden estar sincronizadas en el tiempo.,"multilidar, multistatic",ontolidar:ScanGeometry
ontolidar:MeasurementVolume,Measurement volume,,,Volume di misurazione,Volumen de medición,测量范围,,,The region characterised by the wind lidar. Corresponds to the region penetrated by the various beam orientations / lines of sight and probe volumes where intermediate data are acquired to produce a final measurement.,测风激光雷达采集信号的空间范围。具体来说，由光束预设的扫描位置所围成的空间，激光雷达将在这个空间内进行测量。,,Lo spazio illuminato dai fasci laser del lidar. Corresponde all'unione di tutte le regioni investigata dai singoli fasci laser (e loro singole aree di misurazione - probe volumes) che possono costituire un sistema lidar da cui le misurazioni grezze sono prese e combinate per costruire la misurazione finale.,"Región caracterizada por el lidar de viento. Corresponde a la región en la que los diferentes rayos con diversas orientaciones (o líneas de visión, LOS por sus siglas en inglés) penetran en la atmósfera tomando datos a lo largo de un volumen de muestreo. A lo largo de estos volúmenes de muestreo, cada uno correspondiente a una orientación (o línea de visión) el sistema adquiere datos intermedios de los que se extraen las mediciones finales.",,ontolidar:ScanGeometry
ontolidar:Probe,Probe,,,Sonda,Sonda,探测,,,"In the case of pulsed lidar, the probe is a laser pulse emitted along a line of sight whose orientation is determined by the configuration of the lidar. In the case of a continuous wave lidar, the probe is a part of the laser beam that has a highest power density along the line of sight determined by the optical focus of the system. ",对于脉冲激光雷达，探测是沿视线发射的激光脉冲，其方向和位置由激光雷达的设置决定。对于连续波激光雷达，探测是沿视线方向聚集灵敏度相对较高的区域，由取决于系统的光学焦点。,,"Parte del lidar che interagisce con lo spazio esterno e permette di effettuare la misurazione. In un sistema pulsato, questo corrisponde ad un impulso di luce laser; in un sistema ad onda continua, è definita in modo statistico sulla distribuzione in potenza della luce emessa dal lidar nella direzione di misurazione.","En el caso de un lidar pulsado, el sondeo es un pulso láser emitido a lo largo de la línea de visión (line-of-sight o LOS, por sus siglas en inglés) cuya orientación se determina por la configuración del lidar. En el caso de un lidar de onda continua el sondeo es una región relativamenta sensible a lo largo de la línea de visión determinada por la  distancia focal del sistema.",,ontolidar:MeasurementSetup
ontolidar:Range,Range,,,Range,,探测距离,,,"The maximum distance beyond which detection is limited by a data availability criterion, for example, SNR.",探测的最大距离。超过这个距离，数据可用性会降低，例如，信噪比超出正常范围。,,"La distanza massima oltre cui la misurazione è inibita a causa di criteri sulla disponibilità di segnale (ad esemçpio, insufficiente SNR)","Distancia máxima a partir de la cual la detección está limitada por un criterio de disponibilidad de datos, por ejemplo, la SNR.",,ontolidar:Probe
ontolidar:FocusDistance,Focus distance,,,Distanza di messa a fuoco,,焦距,,,The distance from the lidar to the telescope focal length.  Ideally coincides with the laser beam waist.,从测风激光雷达到激光束汇聚点的距离，由望远镜的焦距规定。,,La distanza fra il centro della lente ottica e il suo fuoco.,Distancia desde el lidar hasta la distancia focal del telescopio. Idealmente coincide con el punto de convergencia máxima de luz del rayo.,,ontolidar:Range
ontolidar:TimeOfFlight,Time of flight,,,Tempo di volo,Tiempo de vuelo,飞行时间,,,"The time taken for a lidar pulse to be emitted, interact with the atmosphere in a probe volume such that it is backscattered, and return to be detected by the system.",从激光雷达脉冲发射，到反射信号返回并被系统检测到所需要的时间。,,"In un sistema lidar pulsato, il tempo necessario fra l'istante dell'emissione di un impulso laser emissione e della ricezione del segnale riflesso. ","El tiempo empleado por un sistema de lidar pulsado desde el momento en que es emitido hasta que es recibio por el sistema, durante el cual interacciona con la atmósfera a lo largo de un volumen de muestreo desde el cual la señal se retrodispersa.",TOF,ontolidar:Range
ontolidar:RangeResolution,Range resolution,,,Risoluzione della distanza,Resolución de distancia,探测间隔分辨率,,,The range resolution is the distance that can be resolved by the laser pulse length. This is given by (half) the speed of light multiplied by the pulse duration.,探测间隔分辨率是激光脉冲波所覆盖的距离。数值上等于光速乘以脉冲持续时间除以二。,,La distanza che può essere risolta dalla lunghezza dell'impulso laser. E' data dalla metà del prodotto fra la velocità della luce e la durata dall'impulso.,Distancia que puede ser resuelta por la longitud del pulso láser. Viene dada por la relación entre la velocidad de la luz y la mitad de la duración del pulso.,,ontolidar:Range
ontolidar:ProbeVolume,Probe volume,,,Volume della sonda,Volumen de la sonda,探测体积,,,The volume in which the probe interacts with the atmosphere resulting in the measurement of a radial velocity.,测风激光雷达测量视线方向速度所覆盖的空间范围。,,Volume spaziale investito dalla sonda del lidar (probe). In questa regione avviene l'interazione fra il sistema lidar e l'atmosfera e da questa regione di deriva la velocità radiale del vento.,Volumen a lo largo del cual la sonda interactúa con la atmósfera dando como resultado la medida de la velocidad radial.,,ontolidar:Probe
ontolidar:RayleighLength,Rayleigh length,,,Lunghezza Rayleigh,Longitud Rayleigh,瑞利长度,,,"Distance, from the beam waist in the propagation direction, where the area of the beam section is increased by a factor of 2, or the radius is increased by a factor of the squared root of 2. The Rayleigh length is used to characterise the probe volume and corresponds to the half of the probe length. It also can be defined as half of the full-width half-maximum (FWHM) of the weighting function characterising the probe volume.","一种距离的表示方式，从传播方向的光束腰部开始，光束部分的截面积面积增加了2倍，或者截面半径增加了根号2倍。瑞利长度用于描述探测体积的特征，相当于探测体长度的一半。
",,Distanza lungo la direzione di propagazione del raggio laser fra il punto di minima apertura radiale del raggio laser al punto di apertura radiale doppia rispetto al valor minimo. La distanza di Rayleigh è usata per caratterizzare il volume della sonda di misurazione e corrisponde a metà della lunghezza della sonda di prova.,"Distancia, tomando como referencia la distancia focal del haz, en la dirección de propagación del mismo, donde el área de la sección del haz se duplica, o dicho de otro modo, el radio se incrementa en un factor raíz de 2. La longitud de Rayleigh se utiliza para caracterizar el volumen de la sonda y corresponde a la mitad de la longitud de muestreo.",,ontolidar:ProbeVolume,,ontolidar:FullWidthAtHalfMaximum
ontolidar:BeamDiameter,Beam diameter,,,Diametro del fascio,,,,,Diameter of the laser beam,,,Diametro del raggio laser,Diámetro del rayo láser.,,ontolidar:ProbeVolume
