ConceptScheme URI,http://vocab.ieawindtask32.org/wind-lidar-ontology/
PREFIX,ontolidar,http://vocab.ieawindtask32.org/wind-lidar-ontology/
PREFIX,pav,http://purl.org/pav/
PREFIX,dct,http://purl.org/dc/terms/
PREFIX,rdf,http://www.w3.org/1999/02/22-rdf-syntax-ns#
PREFIX,rdfs,http://www.w3.org/2000/01/rdf-schema#
skos:prefLabel,IEA Wind Task 32 Wind Lidar Ontology
skos:editorialNote,This glossary is produced and maintained by IEA Wind Task 32.
skos:historyNote,Suggestions for additions or changes should be made through the glossary repository at https://github.com/IEA-Wind-Task-32/wind-lidar-glossary.
dct:title,IEA Wind Task 32 Wind Lidar Ontology
dct:description,Ontological representation of wind lidar supporting development of modular tools and processes for wind lidars.
dct:creator,https://orcid.org/0000-0001-9698-5083
dct:creator,http://orcid.org/0000-0002-9381-9693
dct:creator,https://orcid.org/0000-0003-1318-9677
dct:contributor
pav:version,0.1
pav:createdOn,2020-11-06T00:00:00+01:00
pav:lastUpdatedOn,2021-01-13T00:00:00+01:00

Identifier,skos:prefLabel@en,skos:prefLabel@de,skos:prefLabel@it,rdf:type,rdfs:label,skos:definition@en,skos:definition@de,skos:definition@it,"skos:altLabel(separator="","")","skos:broader(separator="","")",ontolidar:units,"skos:related(separator="","")","skos:exactMatch(separator="","")","dct:creator(separator="","")","dct:contributor(separator="","")",skos:editorialNote@en,skos:editorialNote@de,skos:editorialNote@it,skos:note@en,skos:note@de,skos:note@it
ontolidar:Units,units,,Unità,rdf:Property,units,A unit for parameter or variable being defined.,,Unità di misura per una quantità fisica o un parametro
ontolidar:Analysis,Analysis,,Analisi,,,Ways that wind lidar data can be processed to extract useful data,,Processo di estrazione di informazioni utili dai dati grezzi di un lidar.
ontolidar:WindfieldReconstruction,Windfield Reconstruction,,Ricostruzione del campo di vento,,,Approach to processing wind lidar data to estimate a wind vector at one or more points in the domain sampled by the lidar,,Processo di derivazione del vettore campo del vento in uno o più punti dello spazio spazzato dal wind lidar.,Wind field reconstruction,ontolidar:Analysis
ontolidar:VelocityAzimuthDisplay,Velocity-azimuth display,,,,,"VAD is a method of analyzing data from a complete conical scan whereby many closely spaced azimuthal points may be sampled by the lidar, and the data are used to estimate the wind speed at each height using a statistical fitting method.",,"Un particolare metodo di analisi dati di un lidar a geometria conica. Data una scansione completa del cono ad una specifica altezza, i punti di misurazione contigui l'uno all'altro nello spazio vengono combinati secondo metodi statistici di interpolazione per ricostruire la velocità del vento.",VAD,ontolidar:WindfieldReconstruction,,,,,,The VAD method is described in Lhermitte (1966) and Browning and Wexler (1968).
ontolidar:Applications,Applications,Anwendungen,Applicazioni,,,Ways that wind lidar can be used,,Differenti scopi per cui un wind lidar può essere utilizzato.
ontolidar:UseCase,Use case,,Casi di uso,,,"The combination of three elements: 1. Outcome-driven data requirements (as opposed to constraint-driven requirements, see 1st generation sensor / 1st generation measurements); 2. The measurement method selected to fulfil them; 3. The operational conditions that determine the performance of the method with respect to accuracy",,"La combinazione di tre elementi: 1. Requisiti derivati dai risultati attesi (in opposizione ai requisiti definiti dai vincoli del sistema, come nel confronto fra i sensori di prima generazione e le misurazioni di prima generazione); 2. Il metodo di misurazione selezionati per soddisfarli; 3. Le condizioni di operazione che definiscono le prestazioni (in termine di precisione) del metodo impiegato.",,ontolidar:Applications
ontolidar:VirtualMetMast,Virtual met mast,,Torre meteorologica virtuale,,,"A series of wind measurements made at discrete vertical locations, aping a met mast. These can be implemented using many approaches including Crossed RHI (XRHI) and other dual- or triple-lidar measurement",,"Una serie di misurazioni effettuate a varie altezze discrete da terra, in un modo del tutto simile alla distribuzione delle misurazioni dagli anemometri di una torre metereologica. Queste misurazioni possono essere effettuate utilizzando diversi approcci, inclusi il Crossed RHI (XRHI) ed altri sistemi di misurazione a due o tre sistemi laser.",Crossed RHI,ontolidar:Applications
ontolidar:Design,Design,Auslegung,Struttura generale,,,Wind lidar generic design structure,,Descrizione delle componenti generali di un lidar e del raccordo fra di esse.,,,,,,,,Definition based on the OpenLidar module definitions at https://github.com/e-WindLidar/OpenLidarModuleDefinitions
ontolidar:ChassisModule,Chassis module,,Telaio,,,"The Chassis module is responsible for the various mounting solutions for the lidar, including, but not limited to, mounting on a nacelle, a meteorological tower, the ground, a floating platform, or a mobile structure",,"Modulo di ancoraggio del sistema lidar per ognuna delle sue possibili applicazioni. Include, ma non si limita alle varie soluzioni di montaggio sulla navicella di una turbina, su una torre metereologica, a terra, su una piattaforma flottante o su una struttura mobile.",,ontolidar:Design,,,,,,Definition based on the OpenLidar module definitions at https://github.com/e-WindLidar/OpenLidarModuleDefinitions
ontolidar:ControlModule,Control module,,Componente di controllo,,,The control module is the interface between the external controller (human or machine) and the lidar system,,Modulo di interfaccia fra l'utente di controllo esterno (umano per controllo manuale o un software per un controllo automatico) ed il sistema lidar.,,ontolidar:Design,,,,,,Definition based on the OpenLidar module definitions at https://github.com/e-WindLidar/OpenLidarModuleDefinitions
ontolidar:CommunicationsModule,Communications module,,Componente di comunicazione,,,The system of devices and software that transmit and receive data and commands to and from the lidar device,,"Modulo (composto da parti hardware e software) che trasmette e riceve dati e comandi, da e per il sistema lidar.",,ontolidar:ControlModule,,,,,,Definition based on the OpenLidar module definitions at https://github.com/e-WindLidar/OpenLidarModuleDefinitions
ontolidar:SignalProcessingModule,Signal processing module,,Componente di processamento dati,,,The signal processing module is used to convert the data acquired by the lidar into a data product,,Modulo utilizzato per convertire i dati acquisiti dal lidar nei dati finali richiesti.,,ontolidar:ControlModule,,,,,,Definition based on the OpenLidar module definitions at https://github.com/e-WindLidar/OpenLidarModuleDefinitions
ontolidar:StorageModule,Storage module,,Componente di stoccaggio dati,,,The Storage module is responsible for saving data in the lidar system which will be accessed by users at some future time.,,"Sistema di memoria dati del lidar. Utilizzato per avere accesso ai dati in ogni momento, su richiesta dell'utente.",,ontolidar:ControlModule,,,,,,Definition based on the OpenLidar module definitions at https://github.com/e-WindLidar/OpenLidarModuleDefinitions
ontolidar:SafetyInterlocks,Safety interlocks,,Dispositivi di sicurezza,,,The interlocks are a dispersed set of safety systems that prevent or mitigate potentially dangerous activities.,,"Meccanismi di sicurezza diffusi nel sistema lidar, atti a prevenire o mitigare le conseguenze di possibili malfunzionamenti. ",,ontolidar:Design,,,,,,Definition based on the OpenLidar module definitions at https://github.com/e-WindLidar/OpenLidarModuleDefinitions
ontolidar:OpticsModule,Optics module,,Componenti ottiche,,,"The optics module is designed to alter the original laser beam into radiation with desired specification that can be sent to the target and received by the detector properly.""",,Parte del lidar che trasforma le proprietà della luce laser da quelle della sorgente a quelle ottimali per essere inviate sul target e poi raccolte dal ricevitore.,,ontolidar:Design,,,,,,Definition based on the OpenLidar module definitions at https://github.com/e-WindLidar/OpenLidarModuleDefinitions
ontolidar:Telescope,Telescope,Teleskop,Telescopio,,,"The system of lenses, mirrors and other optical and mechanical components that emit and receive laser light",,"Il sistema di lenti, specchi ed altri elementi ottici e meccanici che in un lidar emettono e ricevono luce laser.",,ontolidar:OpticsModule
ontolidar:TelescopeAperture,Telescope aperture,,Apertura del telescopio,,,The aperture through which laser light is emitted and received,,La finestra attraverso cui il laser viene emesso e ricevuto fra lo spazio interno del lidar e l'ambiente esterno.,,ontolidar:Telescope
ontolidar:TelescopeApertureDiameter,Telescope aperture diameter,,Diametro dell'apertura del telescopio,,,Characteristic optical diameter of the lidar telescope,,Diametro ottico del telescopio del lidar.,,ontolidar:TelescopeAperture,meters
ontolidar:All-fiberLidar,Beam transmission system,,Sistema di trasmissione del fascio,,,All-fiber transmission Lidar system,,Sistema di trasmissione del lidar realizzato interamente in fibra ottica.,,,boolean,,,,,True if lidar is all-fiber
ontolidar:PhotonicsModule,Photonics module,,Componente fotonica,,,The photonics module is the source of emitted light that will be used for the measurements.,,Modulo sorgente della luce laser utilizzato per le misurazioni. ,,ontolidar:Design,,,,,,Definition based on the OpenLidar module definitions at https://github.com/e-WindLidar/OpenLidarModuleDefinitions
ontolidar:Detector,Detector,,Rilevatore,,,An assembly to gather and detect incident light,,"Gruppo di sistemi per ricevere, rilevare e misurare la luce incidente.",,ontolidar:PhotonicsModule
ontolidar:Photodetector,Photodetector,,Fotorivelatore,,,Semiconductor light sensor.,,Fotosensore a semi-conduttori.,,ontolidar:Detector
ontolidar:PhotodetectorGain,Photodetector gain,,Guadagno del fotorivelatore,,,The gain of the photodetector transimpedance amplifier.,,Guadagno dell'amplificatore a transimpedenza del fotodetettore.,,ontolidar:PhotoDetector
ontolidar:PhotodetectorVoltageNoise,Photodetector voltage noise,,Rumore di tensione del fotorivelatore,,,The voltage noise of the photodetector transimpedance amplifier.,,Rumore di tensione dell'amplificatore a transimpedenza del fotodetettore.,,ontolidar:PhotoDetector
ontolidar:AcoustoOpticModulator,Acousto optic modulator,,Modulatore acusto-ottico,,,Bragg cell diffracting and shifting frequency of the light using sound waves (radio-frequency). Produces a pulsed output beam.,,Cella di Bragg per diffrangere e traslare in frequenza la luce utilizzando onde sonore a radiofrequenza. Produce un fascio pulsato in uscita.,AOM,ontolidar:Signal modulation,,,,,,Only pulsed lidar
ontolidar:OpticalAmplifier,Optical amplifier,,Amplificatore ottico,,,An assembly to amplify the outgoing laser light signal without converting it into an electrical signal.,,Sistema di amplificazione della potenza ottica della luce laser emessa.,,ontolidar:Detector,,,,,,Definition based on Wikipedia entry at https://en.wikipedia.org/wiki/Optical_amplifier
ontolidar:BeamSplitter,Beam splitter ,,Sdoppiatore ottico,,,An optical assembly to split a laser beam into two or more beams.,,Un sistema ottico per la divisione di un fascio laser in due o più fasci. ,beamsplitter,ontolidar:Detector,,,,,,Definition based on Wikipedia entry at https://en.wikipedia.org/wiki/Beam_splitter
ontolidar:LaserSource,Laser source,,Sorgente laser,,,An assembly to generate and manage laser light.,,Un sistema di generazione e controllo della luce laser.,,ontolidar:PhotonicsModule
ontolidar:LaserDiode,Laser diode,,Diodo laser,,,A semiconductor component to generate laser light of a defined frequency.,,Un dispositivo optoelettronico a semiconduttore che genera luce laser monocromatica.,,ontolidar:LaserSource
ontolidar:LaserDiodeWavelength,Laser diode wavelength,,Lunghezza d'onda del diodo laser,,,"The nominal wavelength of the laser source. This is defined in units of meters, e.g., 1450E-9 m for a near-infrared laser source.",,La lunghezza d'onda nominale della sorgente laser. Definita in unità di lunghezzza (metri): ad esempio 1450E-9 m per una sorgente laser nel vicino infrarosso.,,ontolidar:LaserDiode,meters
ontolidar:PowerModule,Power module,,Componente di alimentazione,,,"The Power Module is responsible for supplying power to the entire lidar system, including motors, lasers, sensors, and detectors.",,"Modulo di rifornimento e distribuzione dell'energia in ogni parte del sistema lidar, inclusi i motori, il laser, i sensori ed il ricevitore.",,ontolidar:Design,,,,,,Definition based on the OpenLidar module definitions at https://github.com/e-WindLidar/OpenLidarModuleDefinitions
ontolidar:UninterruptiblePowerSupply,Uninterruptible power supply,,Gruppo di continuità (UPS),,,Uninterruptible power supply (UPS),,Gruppo di continuità (UPS).,,ontolidar:PowerModule
ontolidar:UpsBattery,UPS Battery,,Batteria dell'UPS,,,An energy storage component,,Un sistema di riserva di energia - tipicamente una batteria.,,ontolidar:UninterruptablePowerSupply
ontolidar:UpsBatteryVoltage,UPS battery voltage,,Voltaggio della batteria dell'UPS,,,The battery voltage. Units are Volts.,,Il voltaggio della batteria (in unità di Volt).,,ontolidar:UpsBattery,volts
ontolidar:UpsBatteryCapacity,UPS battery capacity,,Capacità della batteria dell'UPS,,,The total stored energy in the battery voltage. Units are Amp Hours (Ah),,La capacità massima del gruppo di continuità (in unità di Ampere-ora (Ah)),,ontolidar:UpsBattery,Amp hours
ontolidar:ScannerModule,Scanner module,,Componente di scansione,,,The scanner orients the beam with respect to the housing and other parts of the lidar system. The scanner may be capable of one or more degrees of freedom.,,Modulo che muove il fascio laser rispetto all'asse principale ed alle altre parti del sistema. Può essere dotato di uno o più gradi di libertà.,,ontolidar:Design,,,,,,Definition based on the OpenLidar module definitions at https://github.com/e-WindLidar/OpenLidarModuleDefinitions
ontolidar:ScannerAzimuthPositioningServo,Scanner azimuth positioning servo,,Servomotore per la scansione nella direzione azimutale,,,The azimuth servo motor drives the scanner in the azimuthal direction,,Servomotore dedicato a muovere il modulo di scansione nel piano azimutale.,,ontolidar:ScannerModule
ontolidar:AzimuthSlewRate,Azimuth slew rate,,Velocità massima azimutale,,,The maximum rate of operation of the servo motor in the azimuthal direction,,Massima velocità di operazione del servomotore nel piano azimutale.,,ontolidar:ScannerAzimuthPositioningServo,degrees per second
ontolidar:ScannerElevationPositioningServo,Scanner elevation positioning servo,,Servomotore per la scansione nella direzione di elevazione,,,The azimuth servo motor drives the scanner in the elevation direction,,Servomotore dedicato a modificare l'altezza sull'orizzonte del fascio laser.,,ontolidar:ScannerModule
ontolidar:ElevationSlewRate,Elevation slew rate,,Velocità massima di elevazione,,,The maximum rate of operation of the servo motor in the elevation direction,,Massima velocità di modifica dell'altezza del fascio laser.,,ontolidar:ScannerElevationPositioningServo,degrees per second
ontolidar:ScannerMirrors,Scanner mirrors,,Specchi dello scanner,,,Mirrors modifying the beam path between the telescope and atmosphere.,,Specchi per modificare il cammino ottico del fascio laser fra il telescopio e l'atmosfera esterna.,,ontolidar:ScannerModule
ontolidar:Devices,Devices,Geräte,Strumenti lidar,,,Specific implementations of wind lidar technologies.,,Particolari realizzazioni di tecnologie lidar per applicazioni eoliche.
ontolidar:Windscanner,Windscanner,Windscanner,Lidar 'WindScanner',,,One of many different types of system that can be used to perform convergent scan geometries. Originally referred to the DTU-led windscanner.eu project.,,Uno dei vari tipi di sistemi che possono essere utilizzati per effettuare scansioni su geometrie convergenti. Originariamente noto come il progetto windscanner.eu project di DTU.,,ontolidar:Devices,,,,,,Describing a wind lidar unit as 'a windscanner' is insufficient information to uniquely describe it's capabilities.
ontolidar:WindIris,Wind Iris,Wind Iris,Lidar 'Wind Iris',,,Type of free-standing lidar device intended for use as a forward-looking lidar mounted on a wind turbine nacelle,,Un particolare tipo di sistema stand-alone lidar con applicazioni per misurazioni dalla navicella di una turbina eolica.,,ontolidar:Devices,,,,,,Describing a wind lidar unit as 'a wind iris' is insufficient information to uniquely describe it's capabilities.
ontolidar:Instances,Instances,Instanzen,Esempi di lidars,,,Wind lidar instances,,Esempi di lidar eolici.
ontolidar:SerialNumber,Serial number,,Numero seriale,,,wind lidar serial number,,Numero di serie del lidar.,,ontolidar:Instances
ontolidar:LidarType,Lidar type,,Tipologia di lidar,,,The type of lidar device,,Tipologia di lidar.,,ontolidar:Instances,,ontolidar:Devices
ontolidar:MeasurementPrinciples,Measurement principles,,Principi di misurazione,,,The means by which a lidar makes a measurement of the wind,,Assunti concettuali alla base della misurazione del vento da parte di un sistema lidar.
ontolidar:LineOfSight,Line of sight,,,,,The line along which lidar signals are emitted and backscattered to be detected by the system.,,La direzione lungo cui il raggio laser del lidar è emesso e riflesso dall'atmosfera verso il lidar.,,ontolidar:MeasurementPrinciples
ontolidar:TimeOfFlight,Time of flight,,Tempo di volo,,,"The time taken for a lidar pulse to be emitted, interact with the atmosphere in a probe volume such that it is backscattered, and return to be detected by the system.",,"In un sistema lidar pulsato, il tempo necessario fra l'istante dell'emissione di un impulso laser emissione e della ricezione del segnale riflesso. ",TOF,ontolidar:MeasurementPrinciples
ontolidar:MeasurementVolume,Measurement volume,,Volume di misurazione,,,The region characterised by the wind lidar. Corresponds to the region penetrated by the various beam orientations / lines of sight and probe volumes where intermediate data are acquired to produce a final measurement.,,Lo spazio illuminato dai fasci laser del lidar. Corresponde all'unione di tutte le regioni investigata dai singoli fasci laser (e loro singole aree di misurazione - probe volumes) che possono costituire un sistema lidar da cui le misurazioni grezze sono prese e combinate per costruire la misurazione finale.,,ontolidar:MeasurementPrinciples
ontolidar:Probe,Probe,,Sonda,,,"In the case of pulsed lidar, the probe is a laser pulse emitted along a line of sight whose orientation is determined by the configuration of the lidar. In the case of a continuous wave lidar, the probe is a region of relatively elevated sensitivity along the line of sight determined by the optical focus of the system.",,"Parte del lidar che interagisce con lo spazio esterno e permette di effettuare la misurazione. In un sistema pulsato, questo corrisponde ad un impulso di luce laser; in un sistema ad onda continua, è definita in modo statistico sulla distribuzione in potenza della luce emessa dal lidar nella direzione di misurazione.",,ontolidar:MeasurementPrinciples
ontolidar:ProbeVolume,Probe volume,,Volume della sonda,,,The volume in which the probe interacts with the atmosphere resulting in the measurement of a radial velocity.,,Volume spaziale investito dalla sonda del lidar (probe). In questa regione avviene l'interazione fra il sistema lidar e l'atmosfera e da questa regione di deriva la velocità radiale del vento.,,ontolidar:Probe
ontolidar:RadialVelocity,Radial velocity,,Velocità radiale,,,"An intermediate variable (see intermediate data), the radial velocity is the radial component of the wind velocity vector relative to the location of the lidar measuring it. It is the projection of the wind velocity vector onto the line of sight, directly measured by observing the Doppler shift of the backscattered laser pulse emitted along the line of sight.",,"Una misurazione intermedia (vedasi intermediate data), specificamente la componente del vettore velocità del vento nella direzione del raggio laser emesso dal lidar (line of sight). La sua derivazione è immediata a partire dalla misurazione dello shift Doppler del raggio riflesso dall'atmosfera rispetto alla frequenza del raggio emesso dal lidar.",Radial wind speed,ontolidar:MeasurementPrinciples
ontolidar:ScanningGeometry,Scanning geometry,,Geometria di scansione,,,1. The arrangement of a sequence of scanning lidar configurations that require the lidar beam to be scanned or swept between a number of different orientations. The scan geometry ensures measurements are acquired throughout the measurement volume sufficient for wind field reconstruction. The sequence of beam orientations may be repeated to acquire a time series of final data acquired from each iteration. Scans may be performed in stop-stare or sweep-stare mode. 2. The collection of lines of sight / beam orientations along which the lidar is programmed to emit its probe.,,1. Una serie di configurazioni di misuraizone per uno scanning lidar che definisce come il fascio laser debba essere mosso e spostato fra una serie di posizioni pre-definite. Questa serie garantisce l'acquisizione in misura sufficiente di dati per ricostruire il campo di vento. La sequenza delle orientazioni può essere ripetuta per registrare una serie temporale della stessa quantità misurata. Il movimento da una posizione di misurazione alla successiva può essere effettuato in modalità stop-stare o sweep-stare. 2. L'insieme delle direzioni di misurazione / orientazioni del fascio laser in cui il lidar emette la sua sonda.,Scan pattern,ontolidar:MeasurementPrinciples,,,,,,The scanning geometry taxonomy is based on Figure 3 in NREL/TP-5000-64634 https://www.nrel.gov/docs/fy16osti/64634.pdf
ontolidar:SingleLidar,Single lidar,,Lidar singolo,,,A single isolated lidar that returns line-of-sight data that are converted in to windfield characteristics without the use of data from another lidar or wind speed measurement device.,,Misurazioni effettuate da un lidar singolo,,ontolidar:ScanningGeometry,,,,,,The scanning geometry taxonomy is based on Figure 3 in NREL/TP-5000-64634 https://www.nrel.gov/docs/fy16osti/64634.pdf
ontolidar:Staring,Staring,,Geometria fissa,,,A scan geometry comprised of a single beam orientation.,,Un lidar con orientazione del fascio laser fissa nello spazio.,,ontolidar:SingleLidar
ontolidar:StopStare,Stop-stare,,"Geometria ""osserva da fisso""",,,"Line-of-sight data are acquired while the beam remains stationary in one of the pre-determined orientations comprising the scan geometry. No data are acquired while the beam is moved to its next position.""@en ;",,Metodo di acquisizione dati in cui la misurazione avviene mentre il fascio laser è mantenuto fermo nello spazio in una direzione predefinita. Nessuna misurazione è effettuata durante la fase di riposizionamento del fascio laser. ,,ontolidar:SingleLidar
ontolidar:SweepStare,Sweep-stare,,"Geometria ""osserva in movimento""",,,Line-of-sight data are acquired continuously as the beam is scanned between pre-determined positions.,,Metodo di acquisizione dati in cui la misurazione avviene mentre il fascio laser è costantemente mosso nello spazio.,,ontolidar:SingleLidar
ontolidar:SimpleScan,Simple scan,,Scansione semplice,,,A simple scan geometry entails variation in beam orientation in a single degree of freedom,,Una geometria di scansione dello spazio dove la posizione del raggio laser dipende da un solo parametro. ,,ontolidar:SingleLidar,,,,,,The scanning geometry taxonomy is based on Figure 3 in NREL/TP-5000-64634 https://www.nrel.gov/docs/fy16osti/64634.pdf
ontolidar:VariableAzimuthScan,Variable azimuth scan,,Scansione ad azimut variabile,,,A simple scan geometry with variable azimuth angle,,Una geometria di scansione dello spazio dipendente solo dall'angolo di azimut del sistema.,,ontolidar:SimpleScan,,,,,,The scanning geometry taxonomy is based on Figure 3 in NREL/TP-5000-64634 https://www.nrel.gov/docs/fy16osti/64634.pdf
ontolidar:CompleteCone,Complete cone,,Geometria a cono completo,,,"A scan geometry in which the azimuth angle of the beam is varied over the full 360 degree range of possible azimuth angles. Wind speed and direction values can be obtained through a wind field reconstruction process, for example by assuming a sinusoidal dependence on azimuth angle.",,"Una geometria di scansione dello spazio in cui il fascio laser è mosso lungo tutto l'intervallo di 360 gradi dell'angolo azimutale. La velocità e la direzione del vento possono essere ottenute attraverso un processo di ricostruzione del campo ventoso che assume, per esempio, una dipendenza sinusoidale della velocità radiale dall'angolo di azimuth.",,ontolidar:VariableAzimuthScan
