ontolidar:ConeSector,Cone sector,,Geometria a settore di cono,,,"A scan geometry in which the azimuth angle of the beam is varied over less than the full 360 degree range of possible azimuth angles. Wind speed and direction values can potentially be obtained through a wind field reconstruction process, for example by assuming a sinusoidal dependence on azimuth angle.",,"Una geometria di scansione dello spazio in cui il fascio laser è mosso lungo una porzione dell'intervallo di 360 gradi dell'angolo azimutale. La velocità e la direzione del vento possono essere ottenute attraverso un processo di ricostruzione del campo ventoso che assume, per esempio, una dipendenza sinusoidale della velocità radiale dall'angolo di azimuth.","Plan-position indicator, PPI",ontolidar:VariableAzimuthScan
ontolidar:DopplerBeamSwinging,Doppler beam swinging,,,,,"A scan geometry in which the azimuth angle of the beam is varied by 90 degrees over the full 360 degree range of possible azimuth angles. Wind speed and direction values can be obtained through a wind field reconstruction process, for example by assuming a sinusoidal dependence on azimuth angle.",,"Una geometria di scansione dello spazio in cui il fascio laser è mosso in intervalli di 90 gradi lungo l'angolo azimutale. La velocità e la direzione del vento possono essere ottenute attraverso un processo di ricostruzione del campo ventoso che assume, per esempio, una dipendenza sinusoidale della velocità radiale dall'angolo di azimuth.",DBS,ontolidar:VariableAzimuthScan
ontolidar:VariableElevation,Variable elevation,,Geometria ad elevazione variabile,,,A simple scan geometry with variable elevation angle,,Una geometria di scansione dello spazio in cui l'angolo di elevazione varia.,,ontolidar:SimpleScan,,,,,,The scanning geometry taxonomy is based on Figure 3 in NREL/TP-5000-64634 https://www.nrel.gov/docs/fy16osti/64634.pdf
ontolidar:VerticalSlice,Vertical slice,,Geometria a taglio verticale,,,Scans can be made where the beam is swept through a vertical slice by varying the elevation angle but not the azimuth angle. These scans are also known as range-height-indicator (RHI) scans. This scan geometry may be used to look at details in the flow in the cross-sectional surface sampled by the scan,,Una geometria di misurazione dove il fascio laser è mosso verticalmente variando solo l'angolo di elevazione ma non l'angolo azimutale. Questo tipo di scansioni sono anche note come scansioni RHI - range-height-indicator. E' comune utilizzare questo tipo di scansioni per osservare dettagli nel flusso nella sezione trasversa al piano di scansione.,"Range-height indicator, RHI",ontolidar:VariableElevationScan
ontolidar:CompoundScan,Compound scan,,,,,Compound scans include more degrees of freedom and are typically made up of a sequence of simple scans,,,,ontolidar:SingleLidar,,,,,,The scanning geometry taxonomy is based on Figure 3 in NREL/TP-5000-64634 https://www.nrel.gov/docs/fy16osti/64634.pdf
ontolidar:ArbitraryTrajectory,Arbitrary trajectory,,Traiettoria arbitraria,,,Scans can be made where the beam is swept through an arbitrary combination of elevation and azimuth angles to follow a desired trajectory. This could be considered analagous to tracking the path of a flying bird from a fixed location.,,Una geometria di misurazione dove il fascio laser è mosso lungo una combinazione arbitraria di angoli di elevazione e azimutali per seguire una specifica traiettoria spaziale. Questo è del tutto analogo ad una situazione in cui si volesse descrivere in termini geometrici il volo di un uccello utilizzando un punto di riferimento fisso.,,ontolidar:SingleLidar
ontolidar:SequentialScan,Sequential scan,,Scansione sequenziale,,,"In a sequential scan, simple and/or compound scans are executed one after another by the same device to reveal flow characteristics.",,"In una scansione sequenziale, scansioni semplici e/o combinate, sono eseguite in sequenza una dopo l'altra per ricostruire le caratteristiche del flusso ventoso.",,ontolidar:CompoundScan,,,,,,The scanning geometry taxonomy is based on Figure 3 in NREL/TP-5000-64634 https://www.nrel.gov/docs/fy16osti/64634.pdf
ontolidar:MultiLidar,Multi-lidar,,Multi-lidar,,,Coordinated measurements made in the same region by multiple lidar. Measurements may or may not be synchronised in time.,,Misurazioni coordinate effettuate nella stessa regione da più sistemi lidar. Le misurazioni possono essere sincronizzate nel tempo.,"multilidar, multistatic",ontolidar:ScanningGeometry
ontolidar:ConvergentScan,Convergent scan,,Scansione convergente,,,"A measurement configuration involving multiple lidar units which are operated in a coordinated and synchronised manner so that their beams converge and intersect at a succession of probe volumes. If three or more lidar units are used, it is possible to characterise the wind velocity vector in the probe volume where the beams intersect within the limitations prescribed by the probe length, sampling interval, and scan geometry.",,"Una configurazione di misurazione che coinvolge più unità lidar operate in un modo coordinato e sincronizzato in modo tale che i loro fasci convergano e si intersechino in specifici punti dello spazio. Se sono utilizzate tre o più unità lidar, è possibile ricostruire integralmente il vettore velocità del vento nelle aree dove i fasci laser si intersecano, fatto salvi i limiti definiti dalla lunghezza dell'area sensivile, l'intervallo di campionamento e la geometria di misurazione.","Convergent beam, convergent-beam lidar",ontolidar:MultiLidar
ontolidar:Parameters,Parameters,,Parametri,,,Wind lidar-specific parameters.,,Specifici parametri del lidar.
ontolidar:CarrierToNoiseRatio,Carrier to noise ratio,,,,,A measure of lidar return signal strength,,Una misura della forza del segnale di ritorno al lidar.,CNR,ontolidar:Parameters,,,,,,Often used interchangably with SNR
ontolidar:SignalToNoiseRatio,Signal to noise ratio,,,,,A measure of lidar return signal strength,,Una misura della forza del segnale di ritorno al lidar.,SNR,ontolidar:Parameters,,,,,,Often used interchangably with CNR
ontolidar:Azimuth,Azimuth,,Azimut,,,The angle between the line of sight of the lidar and a reference vector on the datum plane.,,L'angolo fra la direzione del fascio laser ed un vettore di riferimento in un piano di riferimento.,Azimuth angle,ontolidar:Parameters,degrees,,,,,"The reference vector from which the azimuth is defined is often true north, but could be some other defined vector."
ontolidar:Elevation,Elevation,,Elevazione,,,The angle between the line of sight of the lidar and the datum plane.,,L'angolo fra la direzione del fascio laser e un piano di riferimento.,Elevation angle,ontolidar:Parameters,degrees
ontolidar:MeasurementHeight,Measurement height,,Altezza di misurazione,,,The nominal height above the datum plane at which a windfield reconstruction process returns a wind speed. Often used for vertically-profiling wind lidars for comparison to point wind speed measurements from an anemometer.,,Altezza nominale sopra il piano di riferimento. Ad essa viene associato il processo di ricostruzione del campo eolico e la misurazione della velocità del vento ad essa associata. Spesso usato nei lidar eolici ad asse verticale per confronto fra le misurazioni dal lidar e da anemometri tradizionali.,,ontolidar:Parameters,meters
ontolidar:DatumElevation,Datum elevation,,Elevazione di riferimento,,,The height of the datum plane above sea level,,Altezza di un piano di riferimento sul livello del mare.,,ontolidar:Parameters,meters,,,,,Sea level should be defined on a project basis and is out of scope of this schema.
ontolidar:DatumPlane,Datum plane,,Piano di riferimento,,,"The horizontal plane from which the measurement height is defined, e.g., lidar window, local ground, a platform top surface, or other reference.",,"Piano orizzontale di riferimento per la misurazione delle altezze locali. Tipicamente la finestra del lidar, il piano terra locale, la parte superiore di una piattaforma o un qualsiasi altro riferimento.",Reference height,ontolidar:Parameters,,ontolidar:DatumFeature
ontolidar:DatumFeature,Datum feature,,Elemento di riferimento,,,A distinguishing feature used to recognise or define the datum plane from which the measurement height is defined,,Un elemento ben distinguibile atto a riconoscere o definire un piano di riferimento per la definizione dell'altezza di misurazione. ,Reference marker,ontolidar:Parameters
