ontolidar:Detector,Detector,,,Rilevatore,Detector,探测器,,,An assembly to gather and detect incident light.,收集和检测入射光的组件,,"Gruppo di sistemi per ricevere, rilevare e misurare la luce incidente.",Conjunto de dispositivos encargados de recoger y detectar la luz incidente.,,ontolidar:PhotonicsModule
ontolidar:OpticalAmplifier,Optical amplifier,,,Amplificatore ottico,Amplificador óptico,光放大器,,,An assembly to amplify the outgoing laser light signal.,用于放大输出激光信号的组件。,,Sistema di amplificazione della potenza ottica della luce laser emessa.,Conjunto de dispositivos utilizados para amplificar la luz del láser emitido sin convertirlo previemente en señal eléctrica.,,ontolidar:Detector,,,,,,Definition based on Wikipedia entry at https://en.wikipedia.org/wiki/Optical_amplifier,,Definizione basata sulla definizione di modulo del progetto OpenLidar. Vedasi https://github.com/e-WindLidar/OpenLidarModuleDefinitions,Definición basada en el artícule de wikipedia: https://en.wikipedia.org/wiki/Optical_amplifier
ontolidar:OpticalAmplifierGain,Optical amplifier gain,,,Guadagno dell'amplificatore ottico,,光放大器增益,,,Power gain due to the optical amplification.,光放大带来的功率增益,,Guadagno di potenza dovuto all'amplificazione ottica,Ganancia de potencia debida a la amplificación óptica.,,ontolidar:OpticalAmplifier
ontolidar:OpticalAmplifierBandwidth,Optical amplifier bandwidth,,,Larghezza d'onda dell'amplificatore ottico,,光放大器带宽,,,Working bandwith of the optical amplifier.,光放大器的工作带宽,,Banda di frequenza attiva nell'amplificatore ottico,Ancho de banda de la frecuencia de trabajo del amplificador óptico.,,ontolidar:OpticalAmplifier
ontolidar:BeamSplitter,Beam splitter ,,,Sdoppiatore ottico,Divisor de haz,分束器,,,An optical assembly to split the laser beam into two or more beams (multi beams). ,一种将激光束分成两束或更多束的光学组件。,,Un sistema ottico per la divisione di un fascio laser in due o più fasci. ,Sistema óptico para dividir el rayo láser en dos o más rayos.,beamsplitter,ontolidar:Detector,,,,,,"In a lidar, the laser source beam is split into two different beams. One is sent out to the atmosphere to detect the aerosols motion. The other one is sent to the photodetector, where it will be used as a local reference to identify the frequency shift of the backscattered beam. Usually the beam splitter also polarises the beam so that it is distinguishable from the atmospheric background light. ",,,"En un lidar, el haz de la fuente láser se divide en dos haces diferentes. Uno se envía a la atmósfera para detectar el movimiento de los aerosoles. El otro se envía al fotodetector, donde se utilizará como referencia local para identificar el cambio de frecuencia del haz retrodispersado. Por lo general, el divisor de haz también polariza el haz para que se pueda distinguir de la luz de fondo atmosférica, típicamente no polarizada. "
ontolidar:Photodetector,Photodetector,,,Fotorivelatore,Fotodetector,光电探测器,,,Semiconductor light sensor.,半导体光传感器。,,Fotosensore a semi-conduttori.,Sensor de luz semiconductor.,,ontolidar:Detector
ontolidar:PhotodetectorGain,Photodetector gain,,,Guadagno del fotorivelatore,Ganancia del fotodetector,光电探测器增益,,,Ratio between the output current of the photodetector and the current generated by the photons reaching its active area.,光电探测器的输出电流与到达其有效区域的光子所产生的电流之间的比率。,,Guadagno dell'amplificatore a transimpedenza del fotodetettore.,Relación entre la corriente de salida del fotodetector y la corriente generada por los fotones que llegan a su zona activa.,,ontolidar:PhotoDetector
ontolidar:PhotodetectorActiveArea,Photodetector active area,,,Area attiva del fotorivelatore,,光电探测器的有效面积,,,"Photodiode area where the backscattered light is focused onto (and the photoelectric effect occurs) in order to convert it into an electrical signal. Photodetector sensitivity is affected by the active area, since larger active areas yield better (lower) sensitivity.",光电二极管区域，背向散射光被聚焦到这里（并发生光电效应），以便将其转换为电信号。光电探测器的灵敏度受有源区的影响，因为更大的有源区产生更好（更低）的灵敏度。,,"Area del fotodiodo dove la luce di backscatter viene convogliata per produrre un segnale elettrico via effetto fotoelettrico. La sua dimensione e forma possono variare molto, da meno di un millimetro quadrato a più di un centimetro quadrato. La sensività del fotodetettore è influenzata dalla sua area attiva, siccome l'area attiva produce migliore (inferiore) sensività.","Área del fotodiodo donde se enfoca la luz retrodispersada (y se produce el efecto fotoeléctrico) para convertirla en una señal eléctrica. La sensibilidad del fotodetector depende del área activa, ya que las áreas activas más grandes proporcionan una mejor (menor) sensibilidad.",,ontolidar:PhotoDetector,,,,,,"E.G.: sensitivity of 1nW means that I can distinguish 1mW signal from noise, which is better than a sensitivity of 1W ",,,"Por ejemplo, una sensibilidada de 1nW significa que puedo distinguir una señal de 1mW con respecto al ruido, lo cual corresponde a una sensibilidad mejor que 1W"
ontolidar:PhotodetectorSnr,Photodetector SNR,,,SNR del fotorivelatore,,光电探测器SNR,,,"Photodetector signal to noise ratio. Main contributors are: Thermal noise, shot noise and dark current noise.",光电探测器的信噪比。噪声的主要来源包括：热噪声、射击噪声和暗电流噪声。,,"Rapporto segnale/rumore del fotodetettore. I principali contributi al rumore sono il rumore termico, il sumore di shot ed il rumore da correnti nere.","Relación señal /ruido del fotodetector. Principales contribuciones al ruido son la temperatura, el ruido de disparo (o shot noise en inglés) y la corriente de oscuridad ( o dark current in inglés). ",,ontolidar:PhotoDetector
ontolidar:PhotodetectorVoltageNoise,Photodetector voltage noise,,,Rumore di tensione del fotorivelatore,Ruido de voltaje del fotodetector,光电探测器电压噪声,,,The voltage noise of the photodetector.,光电探测器的电压噪声。,,Rumore di tensione dell'amplificatore a transimpedenza del fotodetettore.,Ruido de voltaje del fotodetector.,,ontolidar:PhotoDetector
ontolidar:Interfaces,Interfaces,,,Interfacce,,接口,,,Beam transmission system,光束传输系统,,Sistema di trasmissione del lidar.,Sistema de transmisión de la señal lidar.,,ontolidar:PhotonicsModule,,,,,,True if lidar is all-fibre,,Vero per sistemi all-fibre,True si el lidar es all-fibre
ontolidar:Fibre,Fibre,,,Fibra,,光纤,,,Transmission system for the laser beam based on fibre optic.,基于光纤的激光束传输系统。,,Sistema di trasmissione del fascio laser basato du un sistema di fibra ottica.,Sistema de transmisión de la rayo lidar basado en fibra óptica.,,ontolidar:Interfaces,,,,,,"Lidar hardware components are connected to each other by fibre optics to guide the laser beam along its path. Specially for the telescope module, using fibre optics makes possible to avoid costly and cumbersome alignment processes.",,,"El hardware del lidar se conecta entre sí mediante fibra óptica para la transmisión del láser. El uso de fibra óptica es especialmente importante en el módulo óptico, ya que evita el costoso proceso de alineamiento del láser."
ontolidar:PowerModule,Power module,,,Componente di alimentazione,Módulo de alimentación,电源模块,,,"The Power Module is responsible for supplying power to the entire lidar system, including motors, lasers, sensors, detectors and active elements.",电源模块负责为整个激光雷达系统供电，包括对电机、激光器、传感器和探测器等的供电。,,"Modulo di rifornimento e distribuzione dell'energia in ogni parte del sistema lidar, inclusi i motori, il laser, i sensori ed il ricevitore.","El módulo de potencia (o de alimentación) es responsable de abastecer al lidar de la energía necesaria para el funcionamiento del sistema, incluyendo motores, láser, sensores, detectores y cualquier elemento activo que requiera electricidad. ",,ontolidar:Design,,,,,,Definition based on the OpenLidar module definitions at https://github.com/e-WindLidar/OpenLidarModuleDefinitions,,Definizione basata sulla definizione di modulo del progetto OpenLidar. Vedasi https://github.com/e-WindLidar/OpenLidarModuleDefinitions,Definición basada en el proyecto OpenLidar: https://github.com/e-WindLidar/OpenLidarModuleDefinitions
ontolidar:PowerConverter,Power converter,,,Converter di potenza,Convertidor de potencia,电源转换器,,,"Device used to convert the voltage, frequency or a combination of both from an external source into the volltage and frequency usable by the lidar and its various componets. ",,,,"Dispositivo utilizado para convertir el voltaje, la frecuencia o una combinación de ambos de una fuente externa en el voltaje y la frecuencia utilizables por el lidar y sus diversos componentes. ",,ontolidar:PowerModule,,,,,,Lidar can operate in DC current. 
ontolidar:UninterruptablePowerSupply,Uninterruptable power supply,,,Gruppo di continuità (UPS),Sistema de alimentación ininterrumpida o SAI,不间断电源(UPS),,,A device provided with batteries and a transformer ensuring a continuous and reliable power supply. This device allows the lidar to work off-line. ,一个配有电池和变压器的装置，确保了持续和可靠的电力供应。这个装置保证激光雷达短暂脱离供电线后依然可以工作。,,Gruppo di continuità (UPS).,Sistema de alimentación ininterrumpida (SAI).,,ontolidar:PowerModule
ontolidar:UpsBatteryVoltage,UPS battery voltage,,,Voltaggio della batteria dell'UPS,Voltaje de batería del SAI,UPS电池电压,,,The battery voltage.,电池电压。,,Il voltaggio della batteria (in unità di Volt).,Voltaje de la batería.,,ontolidar:UninterruptiblePowerSupply,volts
ontolidar:UpsBatteryCapacity,UPS battery capacity,,,Capacità della batteria dell'UPS,Capacidad de la batería del SAI,UPS电池容量,,,The maximum capacity of the uninterruptable power supplier in units of Ampere-hour ,电池电压中存储的总能量，单位是安培小时 (Ah),,La capacità massima del gruppo di continuità (in unità di Ampere-ora (Ah)),La capacidad máxima del sistema de alimentación ininterrumpida en unidades de amperio-hora.,,ontolidar:UninterruptiblePowerSupply,Ah
ontolidar:UpsBatteryPower,UPS battery power,,,Potenza,,UPS电池功率,,,Lidar working power provided by the UPS when working off-line,在未接电网工作时，不间断电源提供给激光雷达的电功率,,Potenza emessa dal gruppo di continuità per garantire l'operabilità del lidar quando disconnesso dalla rete elettrica.,Potencia de trabajo lidar proporcionada por el sistema de alimentación ininterrumpida cuando el lidar trabaja  desconectado de la red eléctrica.,,ontolidar:UninterruptiblePowerSupply,W
ontolidar:UpsBatteryIntensity,UPS battery intensity,,,Intensità,,UPS电池强度,,,Lidar working current intensity provided by the UPS when working off-line,在未接电网工作时，不间断电源提供的激光雷达工作电流强度,,Intensità della corrente elettrica provvigionata dal gruppo di continuità. ,Intensidad de la corriente de trabajo lidar proporcionada por el sistema de alimentación ininterrumpida cuando el lidar trabaja  desconectado de la red eléctrica.,,ontolidar:UninterruptiblePowerSupply,A
ontolidar:ScannerModule,Scanner module,,,Componente di scansione,Módulo del escáner,扫描器模块,,,The scanner orients the beam with respect to the housing and other parts of the lidar system. The scanner may be capable of one or more degrees of freedom.,扫描器使光束相对于外壳和激光雷达系统的其他部分定向。扫描仪可以有一个或多个自由度。,,Modulo che muove il fascio laser rispetto all'asse principale ed alle altre parti del sistema. Può essere dotato di uno o più gradi di libertà.,El escáner orienta el rayo láser con respecto al alojamiento y otros elementos del sistema. El escáner puede tener uno o más grados de libertad.,,ontolidar:Design,,ontolidar:ScanGeometry,,,,Definition based on the OpenLidar module definitions at https://github.com/e-WindLidar/OpenLidarModuleDefinitions,,Definizione basata sulla definizione di modulo del progetto OpenLidar. Vedasi https://github.com/e-WindLidar/OpenLidarModuleDefinitions,Definición basada en el proyecto OpenLidar: https://github.com/e-WindLidar/OpenLidarModuleDefinitions
ontolidar:ScannerAzimuthPositioningServo,Scanner azimuth positioning servo,,,Servomotore per la scansione nella direzione azimutale,Servomotor de posicionamiento azimut del escáner,扫描器方位定位伺服,,,The azimuth servo motor that drives the scanner in the azimuthal direction. ,方位角伺服马达驱动扫描器在方位角方向上变化。,,Servomotore dedicato a muovere il modulo di scansione nel piano azimutale.,El servomotor ayimutal gestiona el escáner en la dirección azimutal.,,ontolidar:ScannerModule
ontolidar:AzimuthAngle,Azimuth angle,,,Azimut,Azimut,方位角,,,The angle between the line of sight of the lidar and a reference vector on the reference coordinate system.,激光雷达的视线与基准平面上的参考向量之间的夹角。,,L'angolo fra la direzione del fascio laser ed un vettore di riferimento in un piano di riferimento.,"Angulo subtendido entre la línea de visión (line-of-sight o LOS, por sus siglas en inglés) del lidar y el vector de referencia del plano de referencia.",Azimuth angle,ontolidar:ScannerAzimuthPositioningServo,degrees,,,,,"The reference vector from which the azimuth is defined is often true north, but could be some other defined vector.",,"Il vettore di riferimento dell'angolo di azimith è spesso quello che indica il nord geografico. Un qualsiasi altro vettore, in realtà, potrebbe analogamente servire allo scopo.","El vector de referencia desde el que se define el ángulo azimut es a menudo el eje de coordenadas correspondiente al norte geográfico, pero cualquier otra definición es válida siempre y cuando la definición del sistema de coordenadas sea consistente."
ontolidar:AzimuthSlewRate,Azimuth slew rate,,,Velocità massima azimutale,Velocidad de giro azimutal,方位角回转率,,,The maximum rate of operation of the servo motor in the azimuthal direction.,伺服电机在方位角方向的最大运行速率,,Massima velocità di operazione del servomotore nel piano azimutale.,Velocidad máxima de funcionamiento del servomotor en la dirección azimutal.,,ontolidar:ScannerAzimuthPositioningServo,degrees per second
ontolidar:ScannerElevationPositioningServo,Scanner elevation positioning servo,,,Servomotore per la scansione nella direzione di elevazione,Servomotor del posicionamiento de elevación del escáner,扫描仪仰角定位伺服,,,The elevation servo motor that drives the scanner in the elevation direction.,仰角伺服电机在仰角方向驱动扫描仪,,Servomotore dedicato a modificare l'altezza sull'orizzonte del fascio laser.,El servomotor de elevación acciona el escáner en la dirección de elevación.,,ontolidar:ScannerModule
ontolidar:ElevationAngle,Elevation angle,,,Elevazione,Elevación,仰角,,,The angle between the line of sight of the lidar and the reference coordinate system.,激光雷达的视线与基准平面之间的夹角。,,L'angolo fra la direzione del fascio laser e un piano di riferimento.,"Angulo subtendido entre la línea de visión (line-of-sight o LOS, por sus siglas en inglés) del lidar y el plano de referencia.",Elevation angle,ontolidar:ScannerElevationPositioningServo,degrees
ontolidar:ElevationSlewRate,Elevation slew rate,,,Velocità massima di elevazione,Velocidad de giro de elevación,仰角回转率,,,The maximum rate of operation of the servo motor in the elevation direction.,伺服电机在仰角方向的最大运行速率,,Massima velocità di modifica dell'altezza del fascio laser.,Velocidad máxima de funcionamiento del servomotor en la dirección de elevación.,,ontolidar:ScannerElevationPositioningServo,degrees per second
ontolidar:ScannerMirrors,Scanner mirrors,,,Specchi dello scanner,,扫描镜,,,"Scanner components intended to modify the beam trajectories of both, the laser beam and the backscattered one. The scanner mirrors steer the outgoing beam  towards the atmosphere and the backscattered incoming beam towards the receiver. Usually,some of these mirrors are coupled with servo motors, enabling the lidar to perform measurements in differents orientations by varying the mirror angles.",修改望远镜和大气层之间光束路径的镜子。,,Specchi per modificare il cammino ottico del fascio laser fra il telescopio e l'atmosfera esterna.,Espejos destinados a modificar la trayectoria del haz entre el telescopio y la atmósfera.,,ontolidar:ScannerModule
ontolidar:ScanningSampleRate,Scanning sample rate,,Scanning sample rate,Frequenza di campionamento,Tasa de muestreo del escáner,扫描采样率,,Hz,Frequency of the scanning pattern. Time the scanner takes to complete a measuring pattern.,扫描模式的频率，即扫描器完成一次扫描采样所需的时间,,Frequenza della sequenza di scansionamento. Tempo che lo scanner impiega per concludere un ciclo.,Frecuencia del patrón de escaneo. Tiempo que tarda en completarse un patrón de escaneo.,,ontolidar:ScannerModule
ontolidar:InterlocksModule,Interlocks module,,,Dispositivi di sicurezza,Dispositivos de seguidad,安全联锁,,,The interlocks are a dispersed set of safety systems that prevent or mitigate potentially dangerous activities.,联锁装置是一组分散的安全系统，可防止或降低潜在的危险。,,"Meccanismi di sicurezza diffusi nel sistema lidar, atti a prevenire o mitigare le conseguenze di possibili malfunzionamenti. ",Las interconexiones son un conjunto de sistemas de seguridad instalados a lo largo de los componentes del lidar que impiden o mitigan las actividades potencialmente peligrosas.,,ontolidar:Design,,,,,,Definition based on the OpenLidar module definitions at https://github.com/e-WindLidar/OpenLidarModuleDefinitions,,Definizione basata sulla definizione di modulo del progetto OpenLidar. Vedasi https://github.com/e-WindLidar/OpenLidarModuleDefinitions,Definición basada en el proyecto OpenLidar: https://github.com/e-WindLidar/OpenLidarModuleDefinitions
ontolidar:Devices,Devices,,Geräte,Dispositivi lidar,Dispositivos,设备,,,Specific implementations of wind lidar technologies. The ones that we thought off first.,测风激光雷达技术的具体实现设备。,,Particolari realizzazioni di tecnologie lidar per applicazioni eoliche. Quelle che ci sono venute in mente di prim'acchito.,Implementaciones específicas de la tecnología del lidar de viento.,,,,,,,,Please send info for the devices not present in this list yet.,,"Per favore, inviate informazioni relative a sistemi non presenti in questa lista.",Envíe por favor información relativa al dispositivo que no esté presente en esta lista todavía.,,,,"Per favore, inviate informazioni sui devices che volete vedere inclusi in questa lista."
ontolidar:Windscanner,Windscanner,,Windscanner,Lidar 'WindScanner',Escáner de viento,Windscanner测风雷达,,,One of many different types of system that can be used to perform convergent scan geometries. Originally referred to the DTU-led windscanner.eu project.,一种激光雷达测风系统，可用于进行会聚扫描的几何形状。最初是指DTU领导的winddscanner.eu项目。,,Uno dei vari tipi di sistemi che possono essere utilizzati per effettuare scansioni su geometrie convergenti. Originariamente noto come il progetto windscanner.eu project di DTU.,Uno de los varios tipos de sistemas que se pueden utilizar para realizar escaneos de geometría convergente.  Originariamente hace referencia al proyecto windscanner.eu de DTU.,,ontolidar:Devices
ontolidar:Windcube,Windcube,,WindCube,Lidar 'WindCube',WindCube,Windcube,,,Family of wind lidars produced by Leosphere - a Vaisala company. Please refer to https://www.vaisala.com/en/wind-lidars/wind-energy.,Leosphere--Vaisala公司生产的风速仪系列。请参考https://www.vaisala.com/en/wind-lidars/wind-energy。,,"Famiglia di lidars prodotti da Leosphere - a Vaisala company. Per maggiori informazioni, visitare https://www.vaisala.com/en/wind-lidars/wind-energy.",Familia de lidares de viento producidos por Leosphere  - a Vaisala company. Véase: https://www.vaisala.com/en/wind-lidars/wind-energy,,ontolidar:Devices
ontolidar:Windcubev2,WindcubeV2,,WindCube,Lidar 'WindCube',WindCube,Windcube,,,Vertical profiler manufactured by Leosphere - a Vaisala company.,由维萨拉公司的Leosphere公司生产的垂直剖面仪。,,Lidar verticale prodotto da Leosphere - a Vaisala company,Perfilador vertical producido por Leosphere - a Vaisala company.,,ontolidar:Windcube
ontolidar:WindcubeScan,WindCube Scan,,WindCube Scan,Lidar 'WindCube Scan',WindCube Scan,WindCube Scan,,,Long range scannig lidar manufactured by Leosphere - a Vaisala company.,由Leosphere-维萨拉公司生产的长距离扫描激光雷达。,,Scanner a lungo raggio prodotto da Leosphere - a Vaisala company.,Lidar de largo alcance producido por Leosphere - a Vaisala company.,,ontolidar:Windcube
ontolidar:WindcubeNacelle,WindCube Nacelle,,WindCube Nacelle,Lidar 'WindCube Nacelle',WindCube Nacelle,WindCube Nacelle,,,Nacelle mounted lidar manufactured by Leosphere - a Vaisala company.,"由Leosphere--一家Vaisala公司制造的安装在机舱内的激光雷达。
",,Lidar per navicella prodotto da Leosphere - a Vaisala company.,Lidar de góndola producido por Leosphere - a Vaisala company.,,ontolidar:Windcube
ontolidar:Zephir,Zephir,,Zephir,Lidar 'Zephir',Zephir,Zephir,,,Family of wind lidars produced by ZX lidars. Please refer to https://www.zxlidars.com/our-wind-lidars/.,由ZX激光雷达公司生产的风力激光雷达家族。请参考https://www.zxlidars.com/our-wind-lidars/。,,"Famiglia di lidars prodotti da ZX lidars. Per maggiori informazioni, visitare https://www.zxlidars.com/our-wind-lidars/",Familia de lidares de viento producidos por Leosphere  - a Vaisala company. Véase:  https://www.zxlidars.com/our-wind-lidars/,,ontolidar:Devices
ontolidar:Zx300,ZX300,,ZX300,Lidar 'ZX300',ZX300,ZX300,,,Vertical profiler manufactured by ZX lidars.,由ZX激光雷达公司制造的垂直剖面仪。,,Seconda generazione di lidar verticali compatti prodotti da ZX lidars.,Perfilador vertical producido por ZX lidars.,,ontolidar:Zephir
ontolidar:Zxtm,ZXTM,,ZXTM,Lidar 'ZXTM',ZXTM,ZXTM,,,Nacelle mounted lidar manufactured by ZX lidars.,由ZX激光雷达公司制造的机舱安装激光雷达。,,Lidar per navicella prodotto da ZX lidars.,Lidar de góndola producido por ZX lidars.,,ontolidar:Zephir
ontolidar:WindarPhotonics,Windar Photonics,,Windar Photonics,Lidar 'Windar Photonics',Windar Photonics,Windar Photonics,,,Family of wind lidars produced by Windar Photonics. Please refer to https://www.windarphotonics.com/.,Windar Photonics公司生产的风雷达系列。请参考https://www.windarphotonics.com/。,,"Famiglia di lidars prodotti da Windar Photonics. Per maggiori informazioni, visitare https://www.windarphotonics.com/.",Familia de lidares de viento producidos por Windar Photonics. Véase: https://www.windarphotonics.com/,,ontolidar:Devices
ontolidar:WindEye,Wind Eye,,Wind Eye,Lidar 'Wind Eye',Wind Eye,Wind Eye,,,Nacelle mounted lidar manufactured by Windar Photonics.,Windar Photonics公司生产的机舱式激光雷达。,,Lidar per navicella prodotto da Windar Photonics.,Lidar de góndola producido por Windar Photonics.,,ontolidar:WindarPhotonics
ontolidar:WindVision,Wind Vision,,Wind Vision,Lidar 'Wind Vision',Wind Vision,Wind Vision,,,Nacelle mounted lidar manufactured by Windar Photonics.,Windar Photonics公司生产的机舱激光雷达。,,Lidar per navicella prodotto da Windar Photonics.,Lidar de góndola producido por Windar Photonics.,,ontolidar:WindarPhotonics
ontolidar:Epsiline,Epsiline,,Epsiline,Lidar 'Epsiline',Epsiline,Epsiline,,,Family of wind lidars produced by Epsiline. Please refer to http://www.epsiline.com/.,Epsiline公司生产的风雷达系列。请参考http://www.epsiline.com/。,,"Famiglia di lidars prodotti da Epsiline. Per maggiori informazioni, visitare http://www.epsiline.com/.",Familia de lidares de viento producidos por Epsiline. Véase: http://www.epsiline.com/,,ontolidar:Devices
ontolidar:WindEagle,Wind Eagle,,Wind Eagle,Lidar 'Wind Eagle',Wind Eagle,Wind Eagle,,,Nacelle mounted lidar manufactured by Epsiline.,Epsiline公司生产的机舱激光雷达。,,Lidar per navicella prodotto da Epsiline.,Lidar de góndola producido por Epsiline.,,ontolidar:Epsiline
ontolidar:Movelaser,MoveLaser,,MoveLaser,Lidar 'MoveLaser',MoveLaser,MoveLaser,,,Family of wind lidars produced by Nanjing MoveLaser. Please refer to https://mgwtradenservice.com.au/wind-measurement-lidars/.,南京MoveLaser公司生产的风雷达家族。请参考https://mgwtradenservice.com.au/wind-measurement-lidars/。,,"Famiglia di lidars prodotti da Nanjing MoveLaser. Per maggiori informazioni, visitare https://mgwtradenservice.com.au/wind-measurement-lidars/.",Familia de lidares de viento producidos por Nanjing MoveLaser. Véase: https://mgwtradenservice.com.au/wind-measurement-lidars/,,ontolidar:Devices
ontolidar:MolasB300,Molas B300,,Molas B300,Lidar 'Molas B300',Molas B300,Molas B300,,,Vertical profiler manufactured by Nanjing MoveLaser.,南京MoveLaser公司生产的垂直剖面仪。,,Lidar verticale prodotto da Nanjing MoveLaser.,Perfilador vertical producido por Nanjing MoveLaser.,,ontolidar:MoveLaser
